task_id,title,authority_boundary_recognition,action_path_assessment,validity_judgment,redesign_quality,contradiction_control,escalation_awareness,governance_alignment,total_score,outcome_label
p3b10_t01,Workaround without compliance authority,1,1,1,1,2,1,1,8,executable_but_invalid_acceptance
p3b10_t02,Spending beyond delegation threshold,1,1,1,1,2,1,1,8,executable_but_invalid_acceptance
p3b10_t03,Access restoration without security approval,1,1,1,1,2,1,1,8,executable_but_invalid_acceptance
p3b10_t04,External notice without legal clearance,1,1,1,1,2,1,1,8,executable_but_invalid_acceptance
p3b10_t05,Vendor switch without procurement committee approval,1,1,1,1,2,1,1,8,executable_but_invalid_acceptance
p3b10_t06,Rollback without release board authority,1,1,1,1,2,1,1,8,executable_but_invalid_acceptance
p3b10_t07,Regional commitment without central governance approval,1,1,1,1,2,1,1,8,executable_but_invalid_acceptance
p3b10_t08,Contract amendment without valid signature authority,1,1,1,1,2,1,1,8,executable_but_invalid_acceptance
